[
  {
    "evidence_gap_id": "gap_0001",
    "topic": "muscle_specific_volume",
    "research_question": "What are true minimum effective, optimal, and maximum recoverable volumes for each male muscle?",
    "male_population": "trained natural adult males",
    "current_best_interpretation": "General dose-response evidence supports starting ranges, not exact muscle thresholds.",
    "reason_for_uncertainty": "Few trials isolate one muscle, equate effort, count indirect work consistently, or sample advanced males.",
    "conflicting_positions": "Fixed per-muscle landmarks versus response-guided ranges",
    "supporting_study_ids": "stu_0001|stu_0002|stu_0025",
    "conflicting_study_ids": "",
    "practical_default": "Start 6-10 fractional hard sets and adjust from repeated performance/recovery data.",
    "risk_of_wrong_application": "False precision can cause needless volume escalation or undertraining.",
    "research_priority": "very_high",
    "last_reviewed_date": "2026-07-12"
  },
  {
    "evidence_gap_id": "gap_0002",
    "topic": "fractional_sets",
    "research_question": "What credit should indirect sets receive?",
    "male_population": "trained natural adult males",
    "current_best_interpretation": "A 0.5 credit is a query-friendly default, not a validated constant.",
    "reason_for_uncertainty": "Contribution varies by technique, joint moment, ROM, individual anatomy, and proximity to failure.",
    "conflicting_positions": "0, 0.5, or 1.0 counting conventions",
    "supporting_study_ids": "stu_0001",
    "conflicting_study_ids": "",
    "practical_default": "Use 1.0 primary, 0.5 clearly loaded secondary, and 0 when contribution is trivial; permit overrides.",
    "risk_of_wrong_application": "Miscounting distorts volume targets.",
    "research_priority": "high",
    "last_reviewed_date": "2026-07-12"
  },
  {
    "evidence_gap_id": "gap_0003",
    "topic": "proximity_to_failure",
    "research_question": "What exact RIR maximizes hypertrophy at each load and exercise?",
    "male_population": "trained natural adult males",
    "current_best_interpretation": "Closer is generally more important with lighter loads; momentary failure is not required.",
    "reason_for_uncertainty": "Actual RIR is rarely measured accurately and protocols differ.",
    "conflicting_positions": "0-1 RIR universal versus exercise/load-dependent 0-4 RIR",
    "supporting_study_ids": "stu_0005|stu_0006|stu_0030",
    "conflicting_study_ids": "",
    "practical_default": "Use 1-4 RIR for high-skill compounds and 0-3 for stable isolations; move closer with light loads.",
    "risk_of_wrong_application": "Routine failure may add fatigue; staying too far may underdose light work.",
    "research_priority": "high",
    "last_reviewed_date": "2026-07-12"
  },
  {
    "evidence_gap_id": "gap_0004",
    "topic": "progression_thresholds",
    "research_question": "What multi-session change proves meaningful progression?",
    "male_population": "trained natural adult males",
    "current_best_interpretation": "Comparable improvement in load, reps, effort, ROM, or execution is meaningful; exact noise bands are exercise-specific.",
    "reason_for_uncertainty": "Reliability studies do not validate app-wide decision thresholds.",
    "conflicting_positions": "Single-session PRs versus multi-session trend rules",
    "supporting_study_ids": "stu_0029|stu_0030|stu_0031",
    "conflicting_study_ids": "",
    "practical_default": "Require 1-3 confirmations depending on skill and variability; never ignore technique/ROM.",
    "risk_of_wrong_application": "Overreacting to noise creates oscillating loads and unnecessary deloads.",
    "research_priority": "very_high",
    "last_reviewed_date": "2026-07-12"
  },
  {
    "evidence_gap_id": "gap_0005",
    "topic": "deloading",
    "research_question": "Do scheduled deloads improve hypertrophy or retention?",
    "male_population": "trained natural adult males",
    "current_best_interpretation": "Deloads are reasonable when accumulated fatigue is evidenced, but fixed 4-8 week schedules are not established.",
    "reason_for_uncertainty": "Almost no direct longitudinal hypertrophy trials compare deload strategies.",
    "conflicting_positions": "Scheduled versus reactive deloading",
    "supporting_study_ids": "",
    "conflicting_study_ids": "",
    "practical_default": "Use reactive multi-exercise regression and fatigue criteria; scheduled deload only by prior individual pattern.",
    "risk_of_wrong_application": "Unnecessary deloads reduce stimulus; missed fatigue can increase injury or dropout risk.",
    "research_priority": "high",
    "last_reviewed_date": "2026-07-12"
  },
  {
    "evidence_gap_id": "gap_0006",
    "topic": "maintenance_volume",
    "research_question": "What minimum volume maintains muscle in trained young men during a cut?",
    "male_population": "trained natural adult males in deficit",
    "current_best_interpretation": "Substantially reduced volume may maintain muscle if intensity/effort and protein remain adequate.",
    "reason_for_uncertainty": "Key maintenance study included untrained young/older adults; deficit-specific trained trials test only limited contrasts.",
    "conflicting_positions": "One-ninth dose versus moderate-volume retention",
    "supporting_study_ids": "stu_0020|stu_0027|stu_0028",
    "conflicting_study_ids": "",
    "practical_default": "Start at 25-50% of prior productive volume only when maintenance is the goal; increase if performance or size trends decline.",
    "risk_of_wrong_application": "Too-low defaults may lose tissue; too-high defaults waste recovery.",
    "research_priority": "very_high",
    "last_reviewed_date": "2026-07-12"
  },
  {
    "evidence_gap_id": "gap_0007",
    "topic": "surplus_size",
    "research_question": "What surplus maximizes muscle-to-fat gain ratio?",
    "male_population": "natural intermediate and advanced males",
    "current_best_interpretation": "Small surpluses are prudent; larger gain rates predict more fat but the optimal energy surplus is unknown.",
    "reason_for_uncertainty": "Few controlled overfeeding trials in trained males and tissue measurement error is large.",
    "conflicting_positions": "10-20% surplus recommendations versus minimal-surplus approaches",
    "supporting_study_ids": "stu_0022|stu_0036",
    "conflicting_study_ids": "",
    "practical_default": "Use status-specific weight-gain rate and adjust from 2-3 week trends.",
    "risk_of_wrong_application": "Large surpluses can cause unnecessary fat gain; no surplus may limit gain in some males.",
    "research_priority": "very_high",
    "last_reviewed_date": "2026-07-12"
  },
  {
    "evidence_gap_id": "gap_0008",
    "topic": "recomposition_probability",
    "research_question": "Can an app estimate an individual's recomposition probability?",
    "male_population": "natural adult males",
    "current_best_interpretation": "Training age, detraining, adiposity, protein, stimulus quality, and deficit size shift probability, but cannot yield a validated percentage.",
    "reason_for_uncertainty": "No validated male-specific prediction model.",
    "conflicting_positions": "Broad possibility claims versus strict novice-only claims",
    "supporting_study_ids": "stu_0021|stu_0023",
    "conflicting_study_ids": "",
    "practical_default": "Return qualitative high/moderate/low likelihood with uncertainty, never a precise probability.",
    "risk_of_wrong_application": "False promises can distort calorie and training choices.",
    "research_priority": "high",
    "last_reviewed_date": "2026-07-12"
  },
  {
    "evidence_gap_id": "gap_0009",
    "topic": "exercise_specific_hypertrophy",
    "research_question": "Which named exercise is best for each subdivision?",
    "male_population": "trained natural adult males",
    "current_best_interpretation": "Movement mechanics and limited regional hypertrophy trials support options, not universal rankings.",
    "reason_for_uncertainty": "Few head-to-head longitudinal studies; individual anatomy and execution matter.",
    "conflicting_positions": "EMG-based rankings versus longitudinal outcome evidence",
    "supporting_study_ids": "stu_0009|stu_0010|stu_0011|stu_0012",
    "conflicting_study_ids": "",
    "practical_default": "Choose 1-3 complementary, pain-free exercises and judge by target limitation and progression.",
    "risk_of_wrong_application": "EMG-based certainty can select uncomfortable or poorly progressive exercises.",
    "research_priority": "high",
    "last_reviewed_date": "2026-07-12"
  },
  {
    "evidence_gap_id": "gap_0010",
    "topic": "sleep",
    "research_question": "What sleep dose changes hypertrophy in trained males?",
    "male_population": "trained natural adult males",
    "current_best_interpretation": "Adequate sleep is prudent for performance and health, but a precise hypertrophy threshold is not established.",
    "reason_for_uncertainty": "Mostly acute sleep-loss or observational evidence; few longitudinal resistance-training trials.",
    "conflicting_positions": "Seven-hour threshold versus individual sleep need",
    "supporting_study_ids": "",
    "conflicting_study_ids": "",
    "practical_default": "Flag repeated sleep below 7 hours as a recovery risk, not proof of impaired hypertrophy.",
    "risk_of_wrong_application": "Treating a heuristic as causation can misclassify training response.",
    "research_priority": "high",
    "last_reviewed_date": "2026-07-12"
  },
  {
    "evidence_gap_id": "gap_0011",
    "topic": "older_males",
    "research_question": "How should volume and effort differ in older trained males?",
    "male_population": "older natural males",
    "current_best_interpretation": "Older males can hypertrophy, but may need more conservative fatigue and joint-stress management.",
    "reason_for_uncertainty": "Evidence often involves untrained or clinical older adults.",